{
  "$schema": "http://json-schema.org/draft-07/schema#",
  "$id": "https://skyboy.in/schemas/skill.schema.json",
  "title": "Skyboy skill metadata",
  "description": "Machine-readable metadata for one skill folder under skills/<category>/<skill-name>/. The file must be named skill.json and live beside that folder's SKILL.md.",
  "type": "object",
  "required": ["name", "category", "version", "description", "command", "tags", "author", "license"],
  "additionalProperties": false,
  "properties": {
    "name": {
      "type": "string",
      "pattern": "^[a-z0-9][a-z0-9._-]*$",
      "maxLength": 64,
      "description": "The skill's bare slug. Must equal the folder name under skills/<category>/."
    },
    "category": {
      "type": "string",
      "pattern": "^[a-z0-9][a-z0-9_-]*(/[a-z0-9][a-z0-9_-]*)?$",
      "maxLength": 64,
      "description": "Category derived from the folder path under skills/ (top-level folder, optionally subcategory). Must not be invented: it has to match the folder the skill lives in."
    },
    "version": {
      "type": "string",
      "pattern": "^\\d+\\.\\d+\\.\\d+$",
      "description": "Semver. Bump on every content change; the catalog exporter hashes folder contents to detect drift."
    },
    "description": {
      "type": "string",
      "minLength": 20,
      "maxLength": 200,
      "description": "The 160-char display line shown on cards and in search results. No marketing fluff."
    },
    "command": {
      "type": "string",
      "pattern": "^skyboy add [a-z0-9][a-z0-9._-]*$",
      "description": "The exact CLI invocation: 'skyboy add <name>' where <name> equals this file's name field. Cross-checked by validate-skill.go."
    },
    "tags": {
      "type": "array",
      "items": { "type": "string", "pattern": "^[a-z0-9][a-z0-9-]*$", "maxLength": 32 },
      "minItems": 1,
      "maxItems": 10,
      "uniqueItems": true
    },
    "author": {
      "type": "string",
      "minLength": 1,
      "maxLength": 64,
      "description": "Community handle or org name."
    },
    "source_url": {
      "type": ["string", "null"],
      "format": "uri",
      "description": "Upstream repo when the skill is forked or mirrored; null for originals."
    },
    "license": {
      "type": "string",
      "minLength": 1,
      "maxLength": 32,
      "description": "SPDX identifier (MIT, Apache-2.0, ...)."
    },
    "compatible_agents": {
      "type": "array",
      "items": { "type": "string", "pattern": "^[a-z0-9-]+$" },
      "uniqueItems": true,
      "description": "Agent slugs from the catalog's agents list (claude-code, cursor, gemini-cli, ...)."
    },
    "dependencies": {
      "type": "array",
      "maxItems": 10,
      "items": { "type": "string", "pattern": "^(@[a-z0-9-]+/)?[a-z0-9][a-z0-9._-]*$" },
      "uniqueItems": true,
      "description": "Other skyboy skills this one requires, by id. Resolved transitively by 'skyboy add'."
    },
    "last_verified": {
      "type": "string",
      "pattern": "^\\d{4}-\\d{2}-\\d{2}$",
      "description": "ISO date of the last agent-tested pass. Drives staleness flags; missing means never verified."
    },
    "compatibility": {
      "type": "object",
      "maxProperties": 12,
      "description": "Per-agent tested state. Keys are agent slugs (claude-code, cursor, ...); values are objects with an optional tool_surface string (e.g. mcp-2025-06; null/absent = untested) and optional notes string."
    },
    "origin": {
      "type": "string",
      "enum": ["skyboy", "vendor", "community"],
      "description": "Who published the skill: skyboy (official), vendor (vendor repo), or community (default)."
    },
    "verified": {
      "type": "boolean",
      "description": "Review flag for community skills. Must be true for community skills seeking verified tier."
    }
  }
}
