{
  "name": "parasail",
  "category": "model-providers",
  "version": "1.0.0",
  "description": "Integration guide and best practices for using Parasail as a model provider.",
  "command": "skyboy add parasail",
  "tags": ["model-provider", "parasail"],
  "author": "parasail",
  "origin": "vendor",
  "verified": true,
  "source_url": null,
  "license": "MIT",
  "compatible_agents": ["claude-code", "claude-desktop", "cursor", "gemini-cli"]
}
