{
  "name": "digitalocean",
  "category": "model-providers",
  "version": "1.0.0",
  "description": "Integration guide and best practices for using DigitalOcean as a model provider. Includes links to official skill repositories.",
  "command": "skyboy add digitalocean",
  "tags": ["model-provider", "digitalocean", "skills"],
  "author": "digitalocean",
  "origin": "vendor",
  "verified": true,
  "source_url": null,
  "license": "MIT",
  "compatible_agents": ["claude-code", "claude-desktop", "cursor", "gemini-cli"]
}
