{
  "name": "stepfun",
  "category": "model-providers",
  "version": "1.0.0",
  "description": "Integration guide and best practices for using StepFun as a model provider. Includes links to official skill repositories.",
  "command": "skyboy add stepfun",
  "tags": ["model-provider", "stepfun", "skills"],
  "author": "skyboy",
  "source_url": null,
  "license": "MIT",
  "compatible_agents": ["claude-code", "claude-desktop", "cursor", "gemini-cli"]
}
