{
  "name": "Agent-Framework-Samples",
  "category": "model-providers",
  "version": "1.0.0",
  "description": "Examples showing how to use the Microsoft Agent Framework across Python, .NET, and Go implementations",
  "command": "skyboy add Agent-Framework-Samples",
  "tags": [
    "model-provider",
    "agent-framework-samples"
  ],
  "author": "microsoft",
  "origin": "vendor",
  "verified": true,
  "source_url": "https://github.com/microsoft/Agent-Framework-Samples",
  "license": "MIT"
}
