{
  "name": "databricks",
  "category": "model-providers",
  "version": "1.0.0",
  "description": "Integration guide and best practices for using Databricks as a model provider. Includes links to official skill repositories.",
  "command": "skyboy add databricks",
  "tags": ["model-provider", "databricks", "skills"],
  "author": "databricks",
  "origin": "vendor",
  "verified": true,
  "source_url": null,
  "license": "MIT",
  "compatible_agents": ["claude-code", "claude-desktop", "cursor", "gemini-cli"]
}
