{
  "name": "databricks-agent-skills",
  "category": "model-providers",
  "version": "1.0.0",
  "description": "Databricks' official Agent Skills repository — skills for building and operating Databricks agents.",
  "command": "skyboy add databricks-agent-skills",
  "tags": ["model-provider", "databricks", "agents", "skills"],
  "author": "skyboy",
  "source_url": "https://github.com/databricks/databricks-agent-skills",
  "license": "Other",
  "compatible_agents": ["claude-code", "claude-desktop", "cursor", "gemini-cli"]
}
