{
  "name": "cerebras",
  "category": "model-providers",
  "version": "1.0.0",
  "description": "Integration guide and best practices for using Cerebras as a model provider. Includes links to official extension repositories.",
  "command": "skyboy add cerebras",
  "tags": ["model-provider", "cerebras"],
  "author": "cerebras",
  "origin": "vendor",
  "verified": true,
  "source_url": null,
  "license": "MIT",
  "compatible_agents": ["claude-code", "claude-desktop", "cursor", "gemini-cli"]
}
